{
  "status" : "blocker",
  "schemaVersion" : "1",
  "summary" : {
    "blockers" : 1,
    "total" : 7,
    "warnings" : 6
  },
  "operatorText" : "Summary:\n- Blockers: 1\n- Warnings: 6\n\nNext:\n- Metadata \/ Declared vendor ID is missing\n\nBlockers:\n- Metadata: Declared vendor ID is missing\n  The open package session does not declare Package.vendorID.\n\nWarnings:\n- Metadata: Primary locale cast is missing\n  The open package session does not expose cast rows for the primary locale.\n- Metadata: Primary locale crew is missing\n  The open package session does not expose crew rows for the primary locale.\n- Metadata: Primary locale poster art is missing\n  The open package session does not expose Locale.posterArt for the primary locale.\n- Roles: Declared video roles are not classified\n  Found 1 declared video asset, but none classify as Primary Video, Preview\/Trailer Video, or Supplemental Video. source currently resolves as Generic Video (https:\/\/example.invalid\/slate-fixtures\/source.mov).\n- Package: Declared primary asset path is non-local\n  Package declares https:\/\/example.invalid\/slate-fixtures\/source.mov as the primary asset, but Slate cannot verify that path on disk because it is not a local file path.\n\nDeferred Comparisons:\n- Package: Movie comparison unavailable\n  A package is open, but no movie is loaded, so declared-vs-observed media checks were skipped.",
  "nextFinding" : {
    "category" : "metadata",
    "evidence" : "The open package session does not declare Package.vendorID.",
    "fallbackUsed" : false,
    "code" : "metadata.declared_vendor_id_is_missing",
    "scope" : "package-metadata",
    "title" : "Declared vendor ID is missing",
    "identitySource" : "rule-contract",
    "severity" : "blocker"
  },
  "findings" : [
    {
      "category" : "metadata",
      "evidence" : "The open package session does not declare Package.vendorID.",
      "fallbackUsed" : false,
      "code" : "metadata.declared_vendor_id_is_missing",
      "scope" : "package-metadata",
      "title" : "Declared vendor ID is missing",
      "identitySource" : "rule-contract",
      "severity" : "blocker"
    },
    {
      "category" : "metadata",
      "evidence" : "The open package session does not expose cast rows for the primary locale.",
      "fallbackUsed" : false,
      "code" : "metadata.primary_locale_cast_is_missing",
      "scope" : "package-metadata",
      "title" : "Primary locale cast is missing",
      "identitySource" : "rule-contract",
      "severity" : "warning"
    },
    {
      "category" : "metadata",
      "evidence" : "The open package session does not expose crew rows for the primary locale.",
      "fallbackUsed" : false,
      "code" : "metadata.primary_locale_crew_is_missing",
      "scope" : "package-metadata",
      "title" : "Primary locale crew is missing",
      "identitySource" : "rule-contract",
      "severity" : "warning"
    },
    {
      "category" : "metadata",
      "evidence" : "The open package session does not expose Locale.posterArt for the primary locale.",
      "fallbackUsed" : false,
      "code" : "metadata.primary_locale_poster_art_is_missing",
      "scope" : "package-metadata",
      "title" : "Primary locale poster art is missing",
      "identitySource" : "rule-contract",
      "severity" : "warning"
    },
    {
      "category" : "roles",
      "evidence" : "Found 1 declared video asset, but none classify as Primary Video, Preview\/Trailer Video, or Supplemental Video. source currently resolves as Generic Video (https:\/\/example.invalid\/slate-fixtures\/source.mov).",
      "fallbackUsed" : false,
      "code" : "roles.declared_video_roles_are_not_classified",
      "scope" : "track-state",
      "title" : "Declared video roles are not classified",
      "identitySource" : "rule-contract",
      "severity" : "warning"
    },
    {
      "category" : "package",
      "evidence" : "Package declares https:\/\/example.invalid\/slate-fixtures\/source.mov as the primary asset, but Slate cannot verify that path on disk because it is not a local file path.",
      "fallbackUsed" : false,
      "code" : "package.declared_primary_asset_path_is_non_local",
      "scope" : "package-session",
      "title" : "Declared primary asset path is non-local",
      "identitySource" : "rule-contract",
      "severity" : "warning"
    },
    {
      "category" : "package",
      "evidence" : "A package is open, but no movie is loaded, so declared-vs-observed media checks were skipped.",
      "fallbackUsed" : false,
      "code" : "package.movie_comparison_unavailable",
      "scope" : "package-session",
      "title" : "Movie comparison unavailable",
      "identitySource" : "rule-contract",
      "severity" : "warning"
    }
  ],
  "validationResultPayload" : {
    "findings" : [
      {
        "code" : "metadata.declared_vendor_id_is_missing",
        "scope" : "package-metadata",
        "evidence" : "The open package session does not declare Package.vendorID.",
        "fallbackUsed" : false
      },
      {
        "code" : "metadata.primary_locale_cast_is_missing",
        "scope" : "package-metadata",
        "evidence" : "The open package session does not expose cast rows for the primary locale.",
        "fallbackUsed" : false
      },
      {
        "code" : "metadata.primary_locale_crew_is_missing",
        "scope" : "package-metadata",
        "evidence" : "The open package session does not expose crew rows for the primary locale.",
        "fallbackUsed" : false
      },
      {
        "code" : "metadata.primary_locale_poster_art_is_missing",
        "scope" : "package-metadata",
        "evidence" : "The open package session does not expose Locale.posterArt for the primary locale.",
        "fallbackUsed" : false
      },
      {
        "code" : "roles.declared_video_roles_are_not_classified",
        "scope" : "track-state",
        "evidence" : "Found 1 declared video asset, but none classify as Primary Video, Preview\/Trailer Video, or Supplemental Video. source currently resolves as Generic Video (https:\/\/example.invalid\/slate-fixtures\/source.mov).",
        "fallbackUsed" : false
      },
      {
        "code" : "package.declared_primary_asset_path_is_non_local",
        "scope" : "package-session",
        "evidence" : "Package declares https:\/\/example.invalid\/slate-fixtures\/source.mov as the primary asset, but Slate cannot verify that path on disk because it is not a local file path.",
        "fallbackUsed" : false
      },
      {
        "code" : "package.movie_comparison_unavailable",
        "scope" : "package-session",
        "evidence" : "A package is open, but no movie is loaded, so declared-vs-observed media checks were skipped.",
        "fallbackUsed" : false
      }
    ],
    "schemaVersion" : "1"
  }
}
