{
  "status" : "blocker",
  "schemaVersion" : "1",
  "summary" : {
    "blockers" : 2,
    "total" : 6,
    "warnings" : 4
  },
  "operatorText" : "Summary:\n- Blockers: 2\n- Warnings: 4\n\nNext:\n- Metadata \/ Declared vendor ID is missing\n\nBlockers:\n- Metadata: Declared vendor ID is missing\n  The open package session does not declare Package.vendorID.\n- Package: Declared primary asset is missing\n  The open package session does not declare a primary AV asset filename.\n\nWarnings:\n- Metadata: Primary locale cast is missing\n  The open package session does not expose cast rows for the primary locale.\n- Metadata: Primary locale crew is missing\n  The open package session does not expose crew rows for the primary locale.\n- Metadata: Primary locale poster art is missing\n  The open package session does not expose Locale.posterArt for the primary locale.\n\nDeferred Comparisons:\n- Package: Movie comparison unavailable\n  A package is open, but no movie is loaded, so declared-vs-observed media checks were skipped.",
  "nextFinding" : {
    "category" : "metadata",
    "evidence" : "The open package session does not declare Package.vendorID.",
    "fallbackUsed" : false,
    "code" : "metadata.declared_vendor_id_is_missing",
    "scope" : "package-metadata",
    "title" : "Declared vendor ID is missing",
    "identitySource" : "rule-contract",
    "severity" : "blocker"
  },
  "findings" : [
    {
      "category" : "metadata",
      "evidence" : "The open package session does not declare Package.vendorID.",
      "fallbackUsed" : false,
      "code" : "metadata.declared_vendor_id_is_missing",
      "scope" : "package-metadata",
      "title" : "Declared vendor ID is missing",
      "identitySource" : "rule-contract",
      "severity" : "blocker"
    },
    {
      "category" : "package",
      "evidence" : "The open package session does not declare a primary AV asset filename.",
      "fallbackUsed" : false,
      "code" : "package.declared_primary_asset_is_missing",
      "scope" : "package-session",
      "title" : "Declared primary asset is missing",
      "identitySource" : "rule-contract",
      "severity" : "blocker"
    },
    {
      "category" : "metadata",
      "evidence" : "The open package session does not expose cast rows for the primary locale.",
      "fallbackUsed" : false,
      "code" : "metadata.primary_locale_cast_is_missing",
      "scope" : "package-metadata",
      "title" : "Primary locale cast is missing",
      "identitySource" : "rule-contract",
      "severity" : "warning"
    },
    {
      "category" : "metadata",
      "evidence" : "The open package session does not expose crew rows for the primary locale.",
      "fallbackUsed" : false,
      "code" : "metadata.primary_locale_crew_is_missing",
      "scope" : "package-metadata",
      "title" : "Primary locale crew is missing",
      "identitySource" : "rule-contract",
      "severity" : "warning"
    },
    {
      "category" : "metadata",
      "evidence" : "The open package session does not expose Locale.posterArt for the primary locale.",
      "fallbackUsed" : false,
      "code" : "metadata.primary_locale_poster_art_is_missing",
      "scope" : "package-metadata",
      "title" : "Primary locale poster art is missing",
      "identitySource" : "rule-contract",
      "severity" : "warning"
    },
    {
      "category" : "package",
      "evidence" : "A package is open, but no movie is loaded, so declared-vs-observed media checks were skipped.",
      "fallbackUsed" : false,
      "code" : "package.movie_comparison_unavailable",
      "scope" : "package-session",
      "title" : "Movie comparison unavailable",
      "identitySource" : "rule-contract",
      "severity" : "warning"
    }
  ],
  "validationResultPayload" : {
    "findings" : [
      {
        "code" : "metadata.declared_vendor_id_is_missing",
        "scope" : "package-metadata",
        "evidence" : "The open package session does not declare Package.vendorID.",
        "fallbackUsed" : false
      },
      {
        "code" : "package.declared_primary_asset_is_missing",
        "scope" : "package-session",
        "evidence" : "The open package session does not declare a primary AV asset filename.",
        "fallbackUsed" : false
      },
      {
        "code" : "metadata.primary_locale_cast_is_missing",
        "scope" : "package-metadata",
        "evidence" : "The open package session does not expose cast rows for the primary locale.",
        "fallbackUsed" : false
      },
      {
        "code" : "metadata.primary_locale_crew_is_missing",
        "scope" : "package-metadata",
        "evidence" : "The open package session does not expose crew rows for the primary locale.",
        "fallbackUsed" : false
      },
      {
        "code" : "metadata.primary_locale_poster_art_is_missing",
        "scope" : "package-metadata",
        "evidence" : "The open package session does not expose Locale.posterArt for the primary locale.",
        "fallbackUsed" : false
      },
      {
        "code" : "package.movie_comparison_unavailable",
        "scope" : "package-session",
        "evidence" : "A package is open, but no movie is loaded, so declared-vs-observed media checks were skipped.",
        "fallbackUsed" : false
      }
    ],
    "schemaVersion" : "1"
  }
}
